00:09:52.912264 enp0s3 In  IP (tos 0xb8, ttl 63, id 35237, offset 0, flags [DF], proto TCP (6), length 200)
    192.168.60.3.32960 > 192.168.61.10.22: Flags [P.], cksum 0x800f (correct), seq 2227778157:2227778305, ack 4220955048, win 64, options [nop,nop,TS val 4024821786 ecr 1074203336], length 148
00:09:52.954273 enp0s3 Out IP (tos 0x0, ttl 64, id 7637, offset 0, flags [DF], proto TCP (6), length 52)
    192.168.61.10.22 > 192.168.60.3.32960: Flags [.], cksum 0xfa84 (incorrect -> 0x0720), seq 1, ack 148, win 577, options [nop,nop,TS val 1074232597 ecr 4024821786], length 0
00:09:55.709428 enp0s3 Out IP (tos 0x0, ttl 64, id 7638, offset 0, flags [DF], proto TCP (6), length 104)
    192.168.61.10.22 > 192.168.60.3.32960: Flags [P.], cksum 0xfab8 (incorrect -> 0x4f7f), seq 1:53, ack 148, win 577, options [nop,nop,TS val 1074235353 ecr 4024821786], length 52
00:09:55.712170 enp0s3 In  IP (tos 0xb8, ttl 63, id 35238, offset 0, flags [DF], proto TCP (6), length 52)
    192.168.60.3.32960 > 192.168.61.10.22: Flags [.], cksum 0xf336 (correct), seq 148, ack 53, win 64, options [nop,nop,TS val 4024824588 ecr 1074235353], length 0
00:09:57.518460 enp0s3 In  IP (tos 0xb8, ttl 63, id 35239, offset 0, flags [DF], proto TCP (6), length 52)
    192.168.60.3.32960 > 192.168.61.10.22: Flags [F.], cksum 0xec25 (correct), seq 148, ack 53, win 64, options [nop,nop,TS val 4024826396 ecr 1074235353], length 0
00:09:57.528783 enp0s3 Out IP (tos 0x0, ttl 64, id 7639, offset 0, flags [DF], proto TCP (6), length 52)
    192.168.61.10.22 > 192.168.60.3.32960: Flags [F.], cksum 0xfa84 (incorrect -> 0xe308), seq 53, ack 149, win 577, options [nop,nop,TS val 1074237172 ecr 4024826396], length 0
00:09:57.531642 enp0s3 In  IP (tos 0xb8, ttl 63, id 35240, offset 0, flags [DF], proto TCP (6), length 52)
    192.168.60.3.32960 > 192.168.61.10.22: Flags [.], cksum 0xe4fc (correct), seq 149, ack 54, win 64, options [nop,nop,TS val 4024826409 ecr 1074237172], length 0
00:09:59.132626 enp0s3 In  IP (tos 0xb8, ttl 63, id 23581, offset 0, flags [DF], proto TCP (6), length 60)
    192.168.60.3.56646 > 192.168.61.10.22: Flags [S], cksum 0xd9de (correct), seq 1699104217, win 64240, options [mss 1460,sackOK,TS val 4024828012 ecr 0,nop,wscale 10], length 0
00:09:59.132665 enp0s3 Out IP (tos 0x0, ttl 64, id 0, offset 0, flags [DF], proto TCP (6), length 60)
    192.168.61.10.22 > 192.168.60.3.56646: Flags [S.], cksum 0xfa8c (incorrect -> 0xd6e2), seq 4279118599, ack 1699104218, win 65160, options [mss 1460,sackOK,TS val 1074238776 ecr 4024828012,nop,wscale 7], length 0
00:09:59.135595 enp0s3 In  IP (tos 0xb8, ttl 63, id 23582, offset 0, flags [DF], proto TCP (6), length 52)
    192.168.60.3.56646 > 192.168.61.10.22: Flags [.], cksum 0x03f7 (correct), seq 1, ack 1, win 63, options [nop,nop,TS val 4024828014 ecr 1074238776], length 0
00:09:59.135596 enp0s3 In  IP (tos 0xb8, ttl 63, id 23583, offset 0, flags [DF], proto TCP (6), length 85)
    192.168.60.3.56646 > 192.168.61.10.22: Flags [P.], cksum 0x4c89 (correct), seq 1:34, ack 1, win 63, options [nop,nop,TS val 4024828015 ecr 1074238776], length 33: SSH: SSH-2.0-OpenSSH_10.2p1 Debian-2
00:09:59.135724 enp0s3 Out IP (tos 0x0, ttl 64, id 27381, offset 0, flags [DF], proto TCP (6), length 52)
    192.168.61.10.22 > 192.168.60.3.56646: Flags [.], cksum 0xfa84 (incorrect -> 0x0214), seq 1, ack 34, win 509, options [nop,nop,TS val 1074238779 ecr 4024828015], length 0
00:09:59.147498 enp0s3 Out IP (tos 0x0, ttl 64, id 27382, offset 0, flags [DF], proto TCP (6), length 95)
    192.168.61.10.22 > 192.168.60.3.56646: Flags [P.], cksum 0xfaaf (incorrect -> 0xa977), seq 1:44, ack 34, win 509, options [nop,nop,TS val 1074238791 ecr 4024828015], length 43: SSH: SSH-2.0-OpenSSH_9.6p1 Ubuntu-3ubuntu13.14
00:09:59.150925 enp0s3 In  IP (tos 0xb8, ttl 63, id 23584, offset 0, flags [DF], proto TCP (6), length 52)
    192.168.60.3.56646 > 192.168.61.10.22: Flags [.], cksum 0x038c (correct), seq 34, ack 44, win 63, options [nop,nop,TS val 4024828030 ecr 1074238791], length 0
00:09:59.150954 enp0s3 Out IP (tos 0x0, ttl 64, id 27383, offset 0, flags [DF], proto TCP (6), length 1172)
    192.168.61.10.22 > 192.168.60.3.56646: Flags [P.], cksum 0xfee4 (incorrect -> 0xe15a), seq 44:1164, ack 34, win 509, options [nop,nop,TS val 1074238794 ecr 4024828030], length 1120
00:09:59.152510 enp0s3 In  IP (tos 0xb8, ttl 63, id 23585, offset 0, flags [DF], proto TCP (6), length 1500)
    192.168.60.3.56646 > 192.168.61.10.22: Flags [.], cksum 0x3cfc (correct), seq 34:1482, ack 44, win 63, options [nop,nop,TS val 4024828030 ecr 1074238791], length 1448
00:09:59.153326 enp0s3 In  IP (tos 0xb8, ttl 63, id 23586, offset 0, flags [DF], proto TCP (6), length 172)
    192.168.60.3.56646 > 192.168.61.10.22: Flags [P.], cksum 0x3774 (correct), seq 1482:1602, ack 44, win 63, options [nop,nop,TS val 4024828030 ecr 1074238791], length 120
00:09:59.153340 enp0s3 Out IP (tos 0x0, ttl 64, id 27384, offset 0, flags [DF], proto TCP (6), length 52)
    192.168.61.10.22 > 192.168.60.3.56646: Flags [.], cksum 0xfa84 (incorrect -> 0xf731), seq 1164, ack 1602, win 532, options [nop,nop,TS val 1074238796 ecr 4024828030], length 0
00:09:59.159505 enp0s3 In  IP (tos 0xb8, ttl 63, id 23587, offset 0, flags [DF], proto TCP (6), length 1260)
    192.168.60.3.56646 > 192.168.61.10.22: Flags [P.], cksum 0x5110 (correct), seq 1602:2810, ack 1164, win 65, options [nop,nop,TS val 4024828039 ecr 1074238794], length 1208
00:09:59.173143 enp0s3 Out IP (tos 0x0, ttl 64, id 27385, offset 0, flags [DF], proto TCP (6), length 1584)
    192.168.61.10.22 > 192.168.60.3.56646: Flags [P.], cksum 0x0081 (incorrect -> 0x9a2e), seq 1164:2696, ack 2810, win 555, options [nop,nop,TS val 1074238816 ecr 4024828039], length 1532
00:09:59.177552 enp0s3 In  IP (tos 0xb8, ttl 63, id 23588, offset 0, flags [DF], proto TCP (6), length 52)
    192.168.60.3.56646 > 192.168.61.10.22: Flags [.], cksum 0xee1f (correct), seq 2810, ack 2696, win 68, options [nop,nop,TS val 4024828056 ecr 1074238816], length 0
00:09:59.178945 enp0s3 In  IP (tos 0xb8, ttl 63, id 23589, offset 0, flags [DF], proto TCP (6), length 136)
    192.168.60.3.56646 > 192.168.61.10.22: Flags [P.], cksum 0x1eb2 (correct), seq 2810:2894, ack 2696, win 68, options [nop,nop,TS val 4024828058 ecr 1074238816], length 84
00:09:59.219596 enp0s3 Out IP (tos 0x0, ttl 64, id 27387, offset 0, flags [DF], proto TCP (6), length 52)
    192.168.61.10.22 > 192.168.60.3.56646: Flags [.], cksum 0xfa84 (incorrect -> 0xebb3), seq 2696, ack 2894, win 555, options [nop,nop,TS val 1074238863 ecr 4024828058], length 0
00:09:59.222418 enp0s3 In  IP (tos 0xb8, ttl 63, id 23590, offset 0, flags [DF], proto TCP (6), length 96)
    192.168.60.3.56646 > 192.168.61.10.22: Flags [P.], cksum 0x3e63 (correct), seq 2894:2938, ack 2696, win 68, options [nop,nop,TS val 4024828102 ecr 1074238863], length 44
00:09:59.222513 enp0s3 Out IP (tos 0x0, ttl 64, id 27388, offset 0, flags [DF], proto TCP (6), length 52)
    192.168.61.10.22 > 192.168.60.3.56646: Flags [.], cksum 0xfa84 (incorrect -> 0xeb58), seq 2696, ack 2938, win 555, options [nop,nop,TS val 1074238866 ecr 4024828102], length 0
00:09:59.222872 enp0s3 Out IP (tos 0x0, ttl 64, id 27389, offset 0, flags [DF], proto TCP (6), length 96)
    192.168.61.10.22 > 192.168.60.3.56646: Flags [P.], cksum 0xfab0 (incorrect -> 0x48fd), seq 2696:2740, ack 2938, win 555, options [nop,nop,TS val 1074238866 ecr 4024828102], length 44
00:09:59.226254 enp0s3 In  IP (tos 0xb8, ttl 63, id 23591, offset 0, flags [DF], proto TCP (6), length 120)
    192.168.60.3.56646 > 192.168.61.10.22: Flags [P.], cksum 0x9704 (correct), seq 2938:3006, ack 2740, win 68, options [nop,nop,TS val 4024828106 ecr 1074238866], length 68
00:09:59.231632 enp0s3 Out IP (tos 0x0, ttl 64, id 27390, offset 0, flags [DF], proto TCP (6), length 316)
    192.168.61.10.22 > 192.168.60.3.56646: Flags [P.], cksum 0xfb8c (incorrect -> 0xf56c), seq 2740:3004, ack 3006, win 555, options [nop,nop,TS val 1074238875 ecr 4024828106], length 264
00:09:59.278617 enp0s3 In  IP (tos 0xb8, ttl 63, id 23592, offset 0, flags [DF], proto TCP (6), length 52)
    192.168.60.3.56646 > 192.168.61.10.22: Flags [.], cksum 0xeb83 (correct), seq 3006, ack 3004, win 71, options [nop,nop,TS val 4024828158 ecr 1074238875], length 0
00:10:00.690819 enp0s3 In  IP (tos 0xb8, ttl 63, id 23593, offset 0, flags [DF], proto TCP (6), length 200)
    192.168.60.3.56646 > 192.168.61.10.22: Flags [P.], cksum 0x968d (correct), seq 3006:3154, ack 3004, win 71, options [nop,nop,TS val 4024829571 ecr 1074238875], length 148
00:10:00.733738 enp0s3 Out IP (tos 0x0, ttl 64, id 27391, offset 0, flags [DF], proto TCP (6), length 52)
    192.168.61.10.22 > 192.168.60.3.56646: Flags [.], cksum 0xfa84 (incorrect -> 0xdd92), seq 3004, ack 3154, win 577, options [nop,nop,TS val 1074240377 ecr 4024829571], length 0
00:10:03.679843 enp0s3 Out IP (tos 0x0, ttl 64, id 27392, offset 0, flags [DF], proto TCP (6), length 104)
    192.168.61.10.22 > 192.168.60.3.56646: Flags [P.], cksum 0xfab8 (incorrect -> 0xbeac), seq 3004:3056, ack 3154, win 577, options [nop,nop,TS val 1074243323 ecr 4024829571], length 52
00:10:03.686783 enp0s3 In  IP (tos 0xb8, ttl 63, id 23594, offset 0, flags [DF], proto TCP (6), length 52)
    192.168.60.3.56646 > 192.168.61.10.22: Flags [.], cksum 0xc822 (correct), seq 3154, ack 3056, win 71, options [nop,nop,TS val 4024832567 ecr 1074243323], length 0
00:10:07.082704 enp0s3 In  IP (tos 0xb8, ttl 63, id 23595, offset 0, flags [DF], proto TCP (6), length 200)
    192.168.60.3.56646 > 192.168.61.10.22: Flags [P.], cksum 0x98c9 (correct), seq 3154:3302, ack 3056, win 71, options [nop,nop,TS val 4024835970 ecr 1074243323], length 148
00:10:07.082770 enp0s3 Out IP (tos 0x0, ttl 64, id 27393, offset 0, flags [DF], proto TCP (6), length 52)
    192.168.61.10.22 > 192.168.60.3.56646: Flags [.], cksum 0xfa84 (incorrect -> 0xaae7), seq 3056, ack 3302, win 600, options [nop,nop,TS val 1074246726 ecr 4024835970], length 0
00:10:12.666723 enp0s3 Out IP (tos 0x0, ttl 64, id 27394, offset 0, flags [DF], proto TCP (6), length 104)
    192.168.61.10.22 > 192.168.60.3.56646: Flags [P.], cksum 0xfab8 (incorrect -> 0xeb09), seq 3056:3108, ack 3302, win 600, options [nop,nop,TS val 1074252310 ecr 4024835970], length 52
00:10:12.670013 enp0s3 In  IP (tos 0xb8, ttl 63, id 23596, offset 0, flags [DF], proto TCP (6), length 52)
    192.168.60.3.56646 > 192.168.61.10.22: Flags [.], cksum 0x811b (correct), seq 3302, ack 3108, win 71, options [nop,nop,TS val 4024841563 ecr 1074252310], length 0
00:10:14.940610 enp0s3 In  IP (tos 0xb8, ttl 63, id 23597, offset 0, flags [DF], proto TCP (6), length 200)
    192.168.60.3.56646 > 192.168.61.10.22: Flags [P.], cksum 0x4478 (correct), seq 3302:3450, ack 3108, win 71, options [nop,nop,TS val 4024843835 ecr 1074252310], length 148
00:10:14.940662 enp0s3 Out IP (tos 0x0, ttl 64, id 27395, offset 0, flags [DF], proto TCP (6), length 52)
    192.168.61.10.22 > 192.168.60.3.56646: Flags [.], cksum 0xfa84 (incorrect -> 0x6c9d), seq 3108, ack 3450, win 623, options [nop,nop,TS val 1074254584 ecr 4024843835], length 0
00:10:17.736589 enp0s3 Out IP (tos 0x0, ttl 64, id 27396, offset 0, flags [DF], proto TCP (6), length 104)
    192.168.61.10.22 > 192.168.60.3.56646: Flags [P.], cksum 0xfab8 (incorrect -> 0x283d), seq 3108:3160, ack 3450, win 623, options [nop,nop,TS val 1074257380 ecr 4024843835], length 52
